{
  "schema": "zhouyilab-tool/1.0",
  "id": "qimen",
  "name": "奇门遁甲",
  "engine_cli": "build/examples/qi_men_web_cli",
  "calibration_status": "calibrated",
  "pages": [
    "qimen.html"
  ],
  "api_prefixes": [
    "/api/v1/qimen/"
  ],
  "routes": [
    {
      "method": "POST",
      "path": "/api/v1/qimen/charts",
      "handler": "engine_chart",
      "options": {
        "timeout_message": "奇门排盘计算超时"
      }
    }
  ]
}
